{
  "schema_version": "1.0",
  "run_id": "r_fixture_longform",
  "created_at": "2026-07-15T11:20:00Z",
  "request": {
    "schema_version": "1.0",
    "query": "how to become a best youtuber",
    "format": "longform",
    "upload_date": "all",
    "outperformance": "highest",
    "analyze_titles": true,
    "analyze_scripts": true,
    "model": {
      "adapter": "claude-code",
      "model": "default"
    },
    "max_results": 15
  },
  "topic_title": "How to Become a Better YouTuber: Packaging, Retention & Your First 1,000 Subs",
  "summary": "Across the long-form field, packaging beats production — the videos that break out teach one repeatable system (idea, title, thumbnail, hook) instead of narrating a personal YouTube journey. Generic 'grow fast' advice is the most saturated and worst-performing shape in the set.",
  "meta": {
    "window": "All time",
    "filter": "long-form ≥120s",
    "keywords": [
      "how to become a best youtuber",
      "how to grow a youtube channel",
      "youtube growth strategy",
      "how to get more subscribers",
      "youtube algorithm explained",
      "how to get your first 1000 subscribers",
      "youtube thumbnail tips",
      "how to write better youtube titles",
      "youtube packaging strategy",
      "how to hook viewers on youtube",
      "youtube audience retention tips",
      "small youtuber advice",
      "how to start a youtube channel",
      "youtube tips for beginners",
      "why my youtube channel is not growing",
      "how to go viral on youtube",
      "youtube content strategy",
      "how to find your youtube niche",
      "youtube click through rate tips",
      "how to stay consistent on youtube"
    ],
    "ranking": "by views; VSR shown",
    "counts": {
      "unique": 812,
      "longform": 394,
      "curated": 15
    }
  },
  "top_videos": [
    {
      "video_id": "XpopyNZKYKw",
      "title": "How To Start a YouTube Channel - Beginner’s Guide to YouTube",
      "url": "https://www.youtube.com/watch?v=XpopyNZKYKw",
      "watch_url": "https://www.youtube.com/watch?v=XpopyNZKYKw",
      "thumbnail_url": "https://i.ytimg.com/vi/XpopyNZKYKw/hqdefault.jpg",
      "channel_id": "UCoOae5nYA7VqaXzerajD0lg",
      "channel_name": "Ali Abdaal",
      "subscriber_count": 6200000,
      "view_count": 4100000,
      "like_count": 98000,
      "comment_count": 3200,
      "vsr": 0.66,
      "multiplier": null,
      "eng_per_1k": 23.9,
      "engagement_flag": "ok",
      "published_at": "2024-03-12T15:00:00Z",
      "duration_seconds": 1127,
      "duration_label": "18:47",
      "link_status": "verified"
    },
    {
      "video_id": "c5-3gotpgz8",
      "title": "How Beluga Gained 4 Million Subscribers in 3 Months (Genius Strategy)",
      "url": "https://www.youtube.com/watch?v=c5-3gotpgz8",
      "watch_url": "https://www.youtube.com/watch?v=c5-3gotpgz8",
      "thumbnail_url": "https://i.ytimg.com/vi/c5-3gotpgz8/hqdefault.jpg",
      "channel_id": "UClga3ybuyyjpvqsh-cf3DvQ",
      "channel_name": "Paddy Galloway",
      "subscriber_count": 520000,
      "view_count": 3200000,
      "like_count": 142000,
      "comment_count": 5100,
      "vsr": 6.15,
      "multiplier": null,
      "eng_per_1k": 44.38,
      "engagement_flag": "ok",
      "published_at": "2024-08-22T16:30:00Z",
      "duration_seconds": 983,
      "duration_label": "16:23",
      "link_status": "verified"
    },
    {
      "video_id": "FreaAN5WuT8",
      "title": "I Made a Secret YouTube Channel to Prove its Not Luck",
      "url": "https://www.youtube.com/watch?v=FreaAN5WuT8",
      "watch_url": "https://www.youtube.com/watch?v=FreaAN5WuT8",
      "thumbnail_url": "https://i.ytimg.com/vi/FreaAN5WuT8/hqdefault.jpg",
      "channel_id": "UCjPYYvIdTqn9U52p9IxJ72Q",
      "channel_name": "Isaiah Photo",
      "subscriber_count": 140000,
      "view_count": 2100000,
      "like_count": 89000,
      "comment_count": 4300,
      "vsr": 15.0,
      "multiplier": null,
      "eng_per_1k": 42.38,
      "engagement_flag": "ok",
      "published_at": "2025-11-04T14:00:00Z",
      "duration_seconds": 1298,
      "duration_label": "21:38",
      "link_status": "verified"
    },
    {
      "video_id": "XsCiGZaFmaQ",
      "title": "How to Grow a Small Channel FAST (feat. @Unspeakable)",
      "url": "https://www.youtube.com/watch?v=XsCiGZaFmaQ",
      "watch_url": "https://www.youtube.com/watch?v=XsCiGZaFmaQ",
      "thumbnail_url": "https://i.ytimg.com/vi/XsCiGZaFmaQ/hqdefault.jpg",
      "channel_id": "UCZLFu8bHbwtnIgWLg5UtINw",
      "channel_name": "vidIQ",
      "subscriber_count": 1600000,
      "view_count": 1800000,
      "like_count": 41000,
      "comment_count": 1900,
      "vsr": 1.12,
      "multiplier": null,
      "eng_per_1k": 22.78,
      "engagement_flag": "ok",
      "published_at": "2024-06-18T13:00:00Z",
      "duration_seconds": 814,
      "duration_label": "13:34",
      "link_status": "verified"
    },
    {
      "video_id": "P3zU3BzaBWc",
      "title": "How to Get Out of Small Channel H3LL, Forever",
      "url": "https://www.youtube.com/watch?v=P3zU3BzaBWc",
      "watch_url": "https://www.youtube.com/watch?v=P3zU3BzaBWc",
      "thumbnail_url": "https://i.ytimg.com/vi/P3zU3BzaBWc/hqdefault.jpg",
      "channel_id": "UCpFE8BGxvDhBDYCvD1hpYWw",
      "channel_name": "Nate Black",
      "subscriber_count": 310000,
      "view_count": 1400000,
      "like_count": 61000,
      "comment_count": 2800,
      "vsr": 4.52,
      "multiplier": null,
      "eng_per_1k": 43.57,
      "engagement_flag": "ok",
      "published_at": "2025-09-15T17:00:00Z",
      "duration_seconds": 1156,
      "duration_label": "19:16",
      "link_status": "verified"
    },
    {
      "video_id": "jZCupmAOMAE",
      "title": "Why The Smartest Creators I Know Focus on Packaging, Not Content",
      "url": "https://www.youtube.com/watch?v=jZCupmAOMAE",
      "watch_url": "https://www.youtube.com/watch?v=jZCupmAOMAE",
      "thumbnail_url": "https://i.ytimg.com/vi/jZCupmAOMAE/hqdefault.jpg",
      "channel_id": "UCg5WjzrwxRRUUDf7WHKPzsA",
      "channel_name": "Kallaway",
      "subscriber_count": 180000,
      "view_count": 1200000,
      "like_count": 47000,
      "comment_count": 2100,
      "vsr": 6.67,
      "multiplier": null,
      "eng_per_1k": 39.17,
      "engagement_flag": "ok",
      "published_at": "2026-01-28T15:30:00Z",
      "duration_seconds": 742,
      "duration_label": "12:22",
      "link_status": "verified"
    },
    {
      "video_id": "h8OTdq24irE",
      "title": "Small YouTubers NEVER Grow When They Do This",
      "url": "https://www.youtube.com/watch?v=h8OTdq24irE",
      "watch_url": "https://www.youtube.com/watch?v=h8OTdq24irE",
      "thumbnail_url": "https://i.ytimg.com/vi/h8OTdq24irE/hqdefault.jpg",
      "channel_id": "UCei6wyubYC1I1FwZ54LZFiA",
      "channel_name": "Nick Nimmin",
      "subscriber_count": 950000,
      "view_count": 1100000,
      "like_count": 38000,
      "comment_count": 1700,
      "vsr": 1.16,
      "multiplier": null,
      "eng_per_1k": 34.55,
      "engagement_flag": "ok",
      "published_at": "2025-04-09T12:00:00Z",
      "duration_seconds": 638,
      "duration_label": "10:38",
      "link_status": "verified"
    },
    {
      "video_id": "LwkvhlrkEHw",
      "title": "How to Trick YouTube into Growing Your Channel",
      "url": "https://www.youtube.com/watch?v=LwkvhlrkEHw",
      "watch_url": "https://www.youtube.com/watch?v=LwkvhlrkEHw",
      "thumbnail_url": "https://i.ytimg.com/vi/LwkvhlrkEHw/hqdefault.jpg",
      "channel_id": "UCZLFu8bHbwtnIgWLg5UtINw",
      "channel_name": "vidIQ",
      "subscriber_count": 1600000,
      "view_count": 980000,
      "like_count": 29000,
      "comment_count": 1400,
      "vsr": 0.61,
      "multiplier": null,
      "eng_per_1k": 29.59,
      "engagement_flag": "ok",
      "published_at": "2025-02-11T13:00:00Z",
      "duration_seconds": 571,
      "duration_label": "9:31",
      "link_status": "verified"
    },
    {
      "video_id": "MzTDbg1jbZI",
      "title": "The Strategy That Makes Paddy Galloway $100k/Month",
      "url": "https://www.youtube.com/watch?v=MzTDbg1jbZI",
      "watch_url": "https://www.youtube.com/watch?v=MzTDbg1jbZI",
      "thumbnail_url": "https://i.ytimg.com/vi/MzTDbg1jbZI/hqdefault.jpg",
      "channel_id": "UCqz2s2kqtPoV66drKJdmmkA",
      "channel_name": "Mr Berry",
      "subscriber_count": 65000,
      "view_count": 890000,
      "like_count": 34000,
      "comment_count": 1600,
      "vsr": 13.69,
      "multiplier": null,
      "eng_per_1k": 38.2,
      "engagement_flag": "ok",
      "published_at": "2026-03-06T18:00:00Z",
      "duration_seconds": 926,
      "duration_label": "15:26",
      "link_status": "verified"
    },
    {
      "video_id": "NcBQSrz-x1s",
      "title": "To Grow Faster On YouTube Follow This Simple Advice",
      "url": "https://www.youtube.com/watch?v=NcBQSrz-x1s",
      "watch_url": "https://www.youtube.com/watch?v=NcBQSrz-x1s",
      "thumbnail_url": "https://i.ytimg.com/vi/NcBQSrz-x1s/hqdefault.jpg",
      "channel_id": "UCei6wyubYC1I1FwZ54LZFiA",
      "channel_name": "Nick Nimmin",
      "subscriber_count": 950000,
      "view_count": 720000,
      "like_count": 21000,
      "comment_count": 980,
      "vsr": 0.76,
      "multiplier": null,
      "eng_per_1k": 29.17,
      "engagement_flag": "ok",
      "published_at": "2025-07-23T12:00:00Z",
      "duration_seconds": 553,
      "duration_label": "9:13",
      "link_status": "verified"
    },
    {
      "video_id": "SYbQqMeq48o",
      "title": "I Asked MrBeast’s Ex-Strategist How to Hit 100k on YouTube",
      "url": "https://www.youtube.com/watch?v=SYbQqMeq48o",
      "watch_url": "https://www.youtube.com/watch?v=SYbQqMeq48o",
      "thumbnail_url": "https://i.ytimg.com/vi/SYbQqMeq48o/hqdefault.jpg",
      "channel_id": "UCPjNBjflYl0-HQtUvOx0Ibw",
      "channel_name": "Greg Isenberg",
      "subscriber_count": 450000,
      "view_count": 620000,